category,title,creator,publication_year,description
movie,My Fair Lady, Warner Bros.,1964,A misogynistic and snobbish phonetics professor agrees to a wager that he can take a flower girl and make her presentable in high society.
movie,Turbulence, Metro-Goldwyn-Mayer (MGM),1997,"On a flight transporting dangerous convicts, murderer Ryan Weaver manages to break free and cause complete chaos throughout the plane. As various people on board fall victim to Weaver, it is ultimately down to flight attendant Teri Halloran to keep the aircraft from crashing, with on-ground support from an air traffic controller. While Halloran struggles to pilot the plane, Weaver continues to terrorize the surviving members of the crew."
movie,Ice Princess, Walt Disney Pictures,2005,"With the help of her coach, her parents, and the boy who drives the Zamboni machine, nothing can stop Casey (Trachtenberg) from realizing her dream to be a champion figure skater."
movie,Left Behind, Stoney Lake Entertainment,2014,A small group of survivors are left behind after millions of people suddenly vanish during the rapture and the world is plunged into chaos and destruction.
movie,Red Dog, Screen Australia,2011,Based on the legendary true story of the Red Dog who united a disparate local community while roaming the Australian outback in search of his long lost master.
